{
  "$schema": "https://json-schema.org/draft/2020-12/schema",
  "$id": "https://iagent.agency/schemas/rapport-usine.json",
  "title": "Rapport d'usine d'une Box iAgent (brief Factory Installer §46), tel que rapport.py l'écrit et que POST /controle/box/usine/rapport le reçoit",
  "type": "object",
  "additionalProperties": false,
  "required": ["device_id", "reference", "serial", "gamme", "profil_materiel", "inventaire", "installateur", "operateur", "lot", "commence_le", "termine_le", "tests", "verdict", "manquants", "echoues"],
  "properties": {
    "device_id": { "type": "string", "pattern": "^BOX-[0-9a-f]{16}$" },
    "reference": { "type": "string", "pattern": "^IA-FR-(CMD|HOME)-\\d{8}$" },
    "serial": { "type": "string", "minLength": 1, "maxLength": 100 },
    "gamme": { "enum": ["business", "home"] },
    "profil_materiel": { "type": "string", "pattern": "^[a-z0-9][a-z0-9-]{1,40}$" },
    "inventaire": {
      "type": "object", "additionalProperties": false,
      "required": ["cpu", "coeurs", "memoire_go", "disque", "mac", "bios", "tpm", "uefi", "secure_boot", "releve_le"],
      "properties": {
        "cpu": { "type": "string", "minLength": 1, "maxLength": 200 },
        "coeurs": { "type": "integer", "minimum": 1, "maximum": 1024 },
        "memoire_go": { "type": "number", "minimum": 1, "maximum": 4096 },
        "disque": { "type": "object", "additionalProperties": false, "required": ["modele", "capacite_go"], "properties": { "modele": { "type": "string", "minLength": 1 }, "capacite_go": { "type": "number", "minimum": 1 } } },
        "mac": { "type": "object", "additionalProperties": false, "required": ["eth0", "eth1", "wifi"], "properties": {
          "eth0": { "type": ["string", "null"], "pattern": "^[0-9a-f]{2}(:[0-9a-f]{2}){5}$" },
          "eth1": { "type": ["string", "null"], "pattern": "^[0-9a-f]{2}(:[0-9a-f]{2}){5}$" },
          "wifi": { "type": ["string", "null"], "pattern": "^[0-9a-f]{2}(:[0-9a-f]{2}){5}$" } } },
        "bios": { "type": "object", "additionalProperties": false, "required": ["fournisseur", "version", "date"], "properties": { "fournisseur": { "type": "string" }, "version": { "type": "string" }, "date": { "type": ["string", "null"] } } },
        "tpm": { "type": "object", "additionalProperties": false, "required": ["present", "version"], "properties": { "present": { "type": "boolean" }, "version": { "type": ["string", "null"] } } },
        "uefi": { "type": "boolean" },
        "secure_boot": { "type": ["boolean", "null"] },
        "releve_le": { "type": "string", "pattern": "^\\d{4}-\\d{2}-\\d{2}T\\d{2}:\\d{2}:\\d{2}(\\.\\d+)?(Z|[+-]\\d{2}:\\d{2})$" }
      }
    },
    "installateur": {
      "type": "object", "additionalProperties": false, "required": ["version", "build_id", "commit"],
      "properties": {
        "version": { "type": "string", "pattern": "^\\d+\\.\\d+\\.\\d+(-[0-9A-Za-z.-]+)?$" },
        "build_id": { "type": "string", "minLength": 1, "maxLength": 100 },
        "commit": { "type": "string", "pattern": "^[0-9a-f]{7,40}$" }
      }
    },
    "operateur": { "type": "string", "minLength": 1, "maxLength": 100 },
    "lot": { "type": ["string", "null"], "maxLength": 100 },
    "commence_le": { "type": "string", "pattern": "^\\d{4}-\\d{2}-\\d{2}T\\d{2}:\\d{2}:\\d{2}(\\.\\d+)?(Z|[+-]\\d{2}:\\d{2})$" },
    "termine_le": { "type": "string", "pattern": "^\\d{4}-\\d{2}-\\d{2}T\\d{2}:\\d{2}:\\d{2}(\\.\\d+)?(Z|[+-]\\d{2}:\\d{2})$" },
    "tests": {
      "type": "array", "minItems": 1, "maxItems": 100,
      "items": {
        "type": "object", "additionalProperties": false, "required": ["id", "libelle", "verdict", "duree_ms", "detail"],
        "properties": {
          "id": { "type": "string", "pattern": "^[a-z][a-z0-9-]{1,39}$" },
          "libelle": { "type": "string", "minLength": 1, "maxLength": 200 },
          "verdict": { "enum": ["passe", "echec", "non_constate"] },
          "duree_ms": { "type": "integer", "minimum": 0 },
          "detail": { "type": ["string", "null"], "maxLength": 2000 }
        }
      }
    },
    "verdict": { "enum": ["passe", "echec"] },
    "manquants": { "type": "array", "items": { "type": "string" } },
    "echoues": { "type": "array", "items": { "type": "string" } }
  }
}
