{
  "device_id": "BOX-9c0d4e5f6a7b8c91",
  "reference": "IA-FR-BUS-00000012",
  "serial": "BG-M4N-2026-00012",
  "gamme": "business",
  "profil_materiel": "bosgame-m4-neo-v1",
  "inventaire": {
    "cpu": "AMD Ryzen 7 7840HS w/ Radeon 780M Graphics",
    "coeurs": 8,
    "memoire_go": 62.7,
    "disque": { "modele": "Samsung SSD 980 PRO 1TB", "capacite_go": 1000 },
    "mac": { "eth0": "a8:b1:c2:d3:e4:01", "eth1": "a8:b1:c2:d3:e4:02", "wifi": "a8:b1:c2:d3:e4:03" },
    "bios": { "fournisseur": "American Megatrends", "version": "1.07", "date": "2026-06-02" },
    "tpm": { "present": false, "version": null },
    "uefi": true,
    "secure_boot": false,
    "releve_le": "2026-10-11T10:40:05Z"
  },
  "installateur": { "version": "0.1.0", "build_id": "IAGENT-FACTORY-0.1.0+42", "commit": "ad6c328f" },
  "operateur": "Léa",
  "lot": "L-2026-10-A",
  "commence_le": "2026-10-11T10:40:00Z",
  "termine_le": "2026-10-11T10:52:12Z",
  "tests": [
    { "id": "materiel", "libelle": "Matériel conforme au profil", "verdict": "echec", "duree_ms": 390, "detail": "aucun TPM vu, le profil exige un TPM 2.0 ; Secure Boot inactif ou non lu, le profil l'exige" },
    { "id": "disque", "libelle": "Disque découpé et données chiffrées", "verdict": "passe", "duree_ms": 170, "detail": "EFI, SYSTEM_A, SYSTEM_B, RECOVERY, DATA (LUKS, ouverte)" },
    { "id": "tpm", "libelle": "TPM 2.0 présent et clé du disque scellée", "verdict": "echec", "duree_ms": 30, "detail": "aucun /sys/class/tpm/tpm0 : pas de TPM vu par le noyau (TPM désactivé dans le BIOS ?)" },
    { "id": "reseau", "libelle": "Réseau sortant et plateforme joignable", "verdict": "passe", "duree_ms": 910, "detail": "liens enp1s0 ; plateforme.iagent.agency répond (clé publique servie)" },
    { "id": "services", "libelle": "Services iAgent actifs", "verdict": "passe", "duree_ms": 300, "detail": "iagent-device, iagent-commander, iagent-updater, iagent-watchdog (iagent-commander attend la qualification)" },
    { "id": "audio", "libelle": "Son : enceintes et microphone", "verdict": "passe", "duree_ms": 4700, "detail": "enceinte gauche jouée ; enceinte droite jouée" },
    { "id": "commander", "libelle": "Desktop Commander installé et armé", "verdict": "passe", "duree_ms": 140, "detail": "iagent-desktop 0.2.0 (dpkg), kiosque armé ; affichage sous cage non constaté en mode usine" },
    { "id": "controle", "libelle": "Control Plane : télémétrie signée acceptée", "verdict": "passe", "duree_ms": 700, "detail": "télémétrie acceptée" },
    { "id": "ota", "libelle": "Mises à jour : relevé et signatures vérifiées", "verdict": "passe", "duree_ms": 1850, "detail": "device 0.1.0 visé, signature vérifiée" }
  ],
  "verdict": "echec",
  "manquants": ["materiel", "tpm"],
  "echoues": ["materiel", "tpm"]
}
